No.     Time           Source                Destination           Protocol Length Info
     11 0.126057       192.168.100.158       192.168.90.253        TCP      80     39743 → 5527 [PSH, ACK] Seq=37 Ack=37 Win=16380 Len=26

Frame 11: 80 bytes on wire (640 bits), 80 bytes captured (640 bits)
Ethernet II, Src: Private_02:05:da (90:6f:18:02:05:da), Dst: BaudDataComm_bb:a4:99 (98:45:62:bb:a4:99)
Internet Protocol Version 4, Src: 192.168.100.158, Dst: 192.168.90.253
Transmission Control Protocol, Src Port: 39743, Dst Port: 5527, Seq: 37, Ack: 37, Len: 26
Data (26 bytes)

0000  6b 00 14 00 00 00 01 00 00 00 24 00 00 00 00 00   k.........$.....
0010  00 00 00 00 00 00 00 00 00 00                     ..........

No.     Time           Source                Destination           Protocol Length Info
     12 0.126596       192.168.90.253        192.168.100.158       TCP      64     5527 → 39743 [PSH, ACK] Seq=37 Ack=63 Win=281 Len=10

Frame 12: 64 bytes on wire (512 bits), 64 bytes captured (512 bits)
Ethernet II, Src: BaudDataComm_d6:a1:6c (98:45:62:d6:a1:6c), Dst: Private_02:05:da (90:6f:18:02:05:da)
Internet Protocol Version 4, Src: 192.168.90.253, Dst: 192.168.100.158
Transmission Control Protocol, Src Port: 5527, Dst Port: 39743, Seq: 37, Ack: 63, Len: 10
Data (10 bytes)

0000  6e 00 04 00 00 00 05 00 00 00                     n.........

No.     Time           Source                Destination           Protocol Length Info
     13 0.127765       192.168.90.253        192.168.100.158       TCP      113    5527 → 39743 [PSH, ACK] Seq=47 Ack=63 Win=281 Len=59

Frame 13: 113 bytes on wire (904 bits), 113 bytes captured (904 bits)
Ethernet II, Src: BaudDataComm_d6:a1:6c (98:45:62:d6:a1:6c), Dst: Private_02:05:da (90:6f:18:02:05:da)
Internet Protocol Version 4, Src: 192.168.90.253, Dst: 192.168.100.158
Transmission Control Protocol, Src Port: 5527, Dst Port: 39743, Seq: 47, Ack: 63, Len: 59
Data (59 bytes)

0000  6d 00 35 00 00 00 01 00 00 00 24 00 00 00 00 00   m.5.......$.....
0010  00 00 00 00 00 00 21 00 00 00 0d 11 31 39 32 2e   ......!.....192.
0020  31 36 38 2e 39 35 2e 36 36 46 45 2d 46 43 2d 46   168.95.66FE-FC-F
0030  45 2d 42 33 2d 37 36 2d 39 42 00                  E-B3-76-9B.

No.     Time           Source                Destination           Protocol Length Info
     14 0.127794       192.168.100.158       192.168.90.253        TCP      54     39743 → 5527 [ACK] Seq=63 Ack=106 Win=16379 Len=0

Frame 14: 54 bytes on wire (432 bits), 54 bytes captured (432 bits)
Ethernet II, Src: Private_02:05:da (90:6f:18:02:05:da), Dst: BaudDataComm_bb:a4:99 (98:45:62:bb:a4:99)
Internet Protocol Version 4, Src: 192.168.100.158, Dst: 192.168.90.253
Transmission Control Protocol, Src Port: 39743, Dst Port: 5527, Seq: 63, Ack: 106, Len: 0

No.     Time           Source                Destination           Protocol Length Info
     15 0.476773       192.168.100.158       192.168.90.253        VNC      58     

Frame 15: 58 bytes on wire (464 bits), 58 bytes captured (464 bits)
Ethernet II, Src: Private_02:05:da (90:6f:18:02:05:da), Dst: BaudDataComm_bb:a4:99 (98:45:62:bb:a4:99)
Internet Protocol Version 4, Src: 192.168.100.158, Dst: 192.168.90.253
Transmission Control Protocol, Src Port: 39746, Dst Port: 5500, Seq: 1, Ack: 1, Len: 4
Virtual Network Computing

No.     Time           Source                Destination           Protocol Length Info
     16 0.477332       192.168.90.253        192.168.100.158       VNC      60     

Frame 16: 60 bytes on wire (480 bits), 60 bytes captured (480 bits)
Ethernet II, Src: BaudDataComm_d6:a1:6c (98:45:62:d6:a1:6c), Dst: Private_02:05:da (90:6f:18:02:05:da)
Internet Protocol Version 4, Src: 192.168.90.253, Dst: 192.168.100.158
Transmission Control Protocol, Src Port: 5500, Dst Port: 39746, Seq: 1, Ack: 5, Len: 4
Virtual Network Computing

No.     Time           Source                Destination           Protocol Length Info
     17 0.523059       192.168.100.158       192.168.90.253        TCP      54     39746 → 5500 [ACK] Seq=5 Ack=5 Win=2043 Len=0

Frame 17: 54 bytes on wire (432 bits), 54 bytes captured (432 bits)
Ethernet II, Src: Private_02:05:da (90:6f:18:02:05:da), Dst: BaudDataComm_bb:a4:99 (98:45:62:bb:a4:99)
Internet Protocol Version 4, Src: 192.168.100.158, Dst: 192.168.90.253
Transmission Control Protocol, Src Port: 39746, Dst Port: 5500, Seq: 5, Ack: 5, Len: 0

No.     Time           Source                Destination           Protocol Length Info
     21 0.788348       192.168.100.158       192.168.90.250        SSL      82     Continuation Data[Illegal Segments]

Frame 21: 82 bytes on wire (656 bits), 82 bytes captured (656 bits)
Ethernet II, Src: Private_02:05:da (90:6f:18:02:05:da), Dst: BaudDataComm_bb:a4:99 (98:45:62:bb:a4:99)
Internet Protocol Version 4, Src: 192.168.100.158, Dst: 192.168.90.250
Transmission Control Protocol, Src Port: 39732, Dst Port: 443, Seq: 2, Ack: 1, Len: 28
[3 Reassembled TCP Segments (29 bytes): #19(1), #21(28), #100(1)]
Transport Layer Security

No.     Time           Source                Destination           Protocol Length Info
     22 0.788896       192.168.90.250        192.168.100.158       TCP      60     443 → 39732 [ACK] Seq=1 Ack=30 Win=229 Len=0

Frame 22: 60 bytes on wire (480 bits), 60 bytes captured (480 bits)
Ethernet II, Src: BaudDataComm_d6:a1:6c (98:45:62:d6:a1:6c), Dst: Private_02:05:da (90:6f:18:02:05:da)
Internet Protocol Version 4, Src: 192.168.90.250, Dst: 192.168.100.158
Transmission Control Protocol, Src Port: 443, Dst Port: 39732, Seq: 1, Ack: 30, Len: 0

No.     Time           Source                Destination           Protocol Length Info
     23 0.789754       192.168.90.250        192.168.100.158       TCP      114    443 → 39732 [PSH, ACK] Seq=1 Ack=30 Win=229 Len=60

Frame 23: 114 bytes on wire (912 bits), 114 bytes captured (912 bits)
Ethernet II, Src: BaudDataComm_d6:a1:6c (98:45:62:d6:a1:6c), Dst: Private_02:05:da (90:6f:18:02:05:da)
Internet Protocol Version 4, Src: 192.168.90.250, Dst: 192.168.100.158
Transmission Control Protocol, Src Port: 443, Dst Port: 39732, Seq: 1, Ack: 30, Len: 60
Data (60 bytes)

0000  41 43 4b 51 00 00 00 02 06 7d e0 cb 00 00 01 2c   ACKQ.....}.....,
0010  4d 6a 55 77 6b 44 7a 68 52 53 55 62 37 33 64 49   MjUwkDzhRSUb73dI
0020  00 00 00 00 00 00 00 00 00 00 00 00 00 00 00 00   ................
0030  00 00 00 00 00 00 00 00 00 00 00 00               ............
