No.     Time           Source                Destination           Protocol Length Info
      1 0.000000       192.168.90.253        192.168.100.158       TCP      72     5527 → 39743 [PSH, ACK] Seq=1 Ack=1 Win=281 Len=18

Frame 1: 72 bytes on wire (576 bits), 72 bytes captured (576 bits)
Ethernet II, Src: BaudDataComm_d6:a1:6c (98:45:62:d6:a1:6c), Dst: Private_02:05:da (90:6f:18:02:05:da)
Internet Protocol Version 4, Src: 192.168.90.253, Dst: 192.168.100.158
Transmission Control Protocol, Src Port: 5527, Dst Port: 39743, Seq: 1, Ack: 1, Len: 18
Data (18 bytes)

0000  04 00 0c 00 00 00 c1 8c 47 64 99 e5 5e 9e 4a ce   ........Gd..^.J.
0010  0a 00                                             ..

No.     Time           Source                Destination           Protocol Length Info
      2 0.000000       192.168.90.253        192.168.100.158       TCP      72     5527 → 39743 [PSH, ACK] Seq=19 Ack=1 Win=281 Len=18

Frame 2: 72 bytes on wire (576 bits), 72 bytes captured (576 bits)
Ethernet II, Src: BaudDataComm_d6:a1:6c (98:45:62:d6:a1:6c), Dst: Private_02:05:da (90:6f:18:02:05:da)
Internet Protocol Version 4, Src: 192.168.90.253, Dst: 192.168.100.158
Transmission Control Protocol, Src Port: 5527, Dst Port: 39743, Seq: 19, Ack: 1, Len: 18
Data (18 bytes)

0000  04 00 0c 00 00 00 c1 8c 47 64 40 2b 5f 9e 4a ce   ........Gd@+_.J.
0010  0a 00                                             ..

No.     Time           Source                Destination           Protocol Length Info
      3 0.000114       192.168.100.158       192.168.90.253        TCP      54     39743 → 5527 [ACK] Seq=1 Ack=37 Win=16380 Len=0

Frame 3: 54 bytes on wire (432 bits), 54 bytes captured (432 bits)
Ethernet II, Src: Private_02:05:da (90:6f:18:02:05:da), Dst: BaudDataComm_bb:a4:99 (98:45:62:bb:a4:99)
Internet Protocol Version 4, Src: 192.168.100.158, Dst: 192.168.90.253
Transmission Control Protocol, Src Port: 39743, Dst Port: 5527, Seq: 1, Ack: 37, Len: 0

No.     Time           Source                Destination           Protocol Length Info
      4 0.000231       192.168.100.158       192.168.90.253        TCP      72     39743 → 5527 [PSH, ACK] Seq=1 Ack=37 Win=16380 Len=18

Frame 4: 72 bytes on wire (576 bits), 72 bytes captured (576 bits)
Ethernet II, Src: Private_02:05:da (90:6f:18:02:05:da), Dst: BaudDataComm_bb:a4:99 (98:45:62:bb:a4:99)
Internet Protocol Version 4, Src: 192.168.100.158, Dst: 192.168.90.253
Transmission Control Protocol, Src Port: 39743, Dst Port: 5527, Seq: 1, Ack: 37, Len: 18
Data (18 bytes)

0000  03 00 0c 00 00 00 c1 8c 47 64 99 e5 5e 9e 4a ce   ........Gd..^.J.
0010  0a 00                                             ..

No.     Time           Source                Destination           Protocol Length Info
      5 0.000264       192.168.100.158       192.168.90.253        TCP      72     39743 → 5527 [PSH, ACK] Seq=19 Ack=37 Win=16380 Len=18

Frame 5: 72 bytes on wire (576 bits), 72 bytes captured (576 bits)
Ethernet II, Src: Private_02:05:da (90:6f:18:02:05:da), Dst: BaudDataComm_bb:a4:99 (98:45:62:bb:a4:99)
Internet Protocol Version 4, Src: 192.168.100.158, Dst: 192.168.90.253
Transmission Control Protocol, Src Port: 39743, Dst Port: 5527, Seq: 19, Ack: 37, Len: 18
Data (18 bytes)

0000  03 00 0c 00 00 00 c1 8c 47 64 40 2b 5f 9e 4a ce   ........Gd@+_.J.
0010  0a 00                                             ..

No.     Time           Source                Destination           Protocol Length Info
      6 0.000764       192.168.90.253        192.168.100.158       TCP      60     5527 → 39743 [ACK] Seq=37 Ack=37 Win=281 Len=0

Frame 6: 60 bytes on wire (480 bits), 60 bytes captured (480 bits)
Ethernet II, Src: BaudDataComm_d6:a1:6c (98:45:62:d6:a1:6c), Dst: Private_02:05:da (90:6f:18:02:05:da)
Internet Protocol Version 4, Src: 192.168.90.253, Dst: 192.168.100.158
Transmission Control Protocol, Src Port: 5527, Dst Port: 39743, Seq: 37, Ack: 37, Len: 0

No.     Time           Source                Destination           Protocol Length Info
      7 0.021806       192.168.100.113       224.0.0.251           MDNS     365    Standard query response 0x0000 PTR, cache flush DESKTOP-3QPVPCQ._dosvc._tcp.local SRV, cache flush 0 0 7680 DESKTOP-3QPVPCQ.local TXT, cache flush A, cache flush 192.168.100.113 AAAA, cache flush fe80::d82c:650e:52f7:8e68

Frame 7: 365 bytes on wire (2920 bits), 365 bytes captured (2920 bits)
Ethernet II, Src: JMicronIntel_c4:dd:c3 (ec:d6:8a:c4:dd:c3), Dst: IPv4mcast_fb (01:00:5e:00:00:fb)
Internet Protocol Version 4, Src: 192.168.100.113, Dst: 224.0.0.251
User Datagram Protocol, Src Port: 5353, Dst Port: 5353
Multicast Domain Name System (response)

No.     Time           Source                Destination           Protocol Length Info
      9 0.023717       192.168.100.113       224.0.0.251           MDNS     301    Standard query response 0x0000 SRV, cache flush 0 0 7680 DESKTOP-3QPVPCQ.local TXT, cache flush A, cache flush 192.168.100.113 AAAA, cache flush fe80::d82c:650e:52f7:8e68

Frame 9: 301 bytes on wire (2408 bits), 301 bytes captured (2408 bits)
Ethernet II, Src: JMicronIntel_c4:dd:c3 (ec:d6:8a:c4:dd:c3), Dst: IPv4mcast_fb (01:00:5e:00:00:fb)
Internet Protocol Version 4, Src: 192.168.100.113, Dst: 224.0.0.251
User Datagram Protocol, Src Port: 5353, Dst Port: 5353
Multicast Domain Name System (response)

No.     Time           Source                Destination           Protocol Length Info
     11 0.126057       192.168.100.158       192.168.90.253        TCP      80     39743 → 5527 [PSH, ACK] Seq=37 Ack=37 Win=16380 Len=26

Frame 11: 80 bytes on wire (640 bits), 80 bytes captured (640 bits)
Ethernet II, Src: Private_02:05:da (90:6f:18:02:05:da), Dst: BaudDataComm_bb:a4:99 (98:45:62:bb:a4:99)
Internet Protocol Version 4, Src: 192.168.100.158, Dst: 192.168.90.253
Transmission Control Protocol, Src Port: 39743, Dst Port: 5527, Seq: 37, Ack: 37, Len: 26
Data (26 bytes)

0000  6b 00 14 00 00 00 01 00 00 00 24 00 00 00 00 00   k.........$.....
0010  00 00 00 00 00 00 00 00 00 00                     ..........

No.     Time           Source                Destination           Protocol Length Info
     12 0.126596       192.168.90.253        192.168.100.158       TCP      64     5527 → 39743 [PSH, ACK] Seq=37 Ack=63 Win=281 Len=10

Frame 12: 64 bytes on wire (512 bits), 64 bytes captured (512 bits)
Ethernet II, Src: BaudDataComm_d6:a1:6c (98:45:62:d6:a1:6c), Dst: Private_02:05:da (90:6f:18:02:05:da)
Internet Protocol Version 4, Src: 192.168.90.253, Dst: 192.168.100.158
Transmission Control Protocol, Src Port: 5527, Dst Port: 39743, Seq: 37, Ack: 63, Len: 10
Data (10 bytes)

0000  6e 00 04 00 00 00 05 00 00 00                     n.........

No.     Time           Source                Destination           Protocol Length Info
     13 0.127765       192.168.90.253        192.168.100.158       TCP      113    5527 → 39743 [PSH, ACK] Seq=47 Ack=63 Win=281 Len=59

Frame 13: 113 bytes on wire (904 bits), 113 bytes captured (904 bits)
Ethernet II, Src: BaudDataComm_d6:a1:6c (98:45:62:d6:a1:6c), Dst: Private_02:05:da (90:6f:18:02:05:da)
Internet Protocol Version 4, Src: 192.168.90.253, Dst: 192.168.100.158
Transmission Control Protocol, Src Port: 5527, Dst Port: 39743, Seq: 47, Ack: 63, Len: 59
Data (59 bytes)

0000  6d 00 35 00 00 00 01 00 00 00 24 00 00 00 00 00   m.5.......$.....
0010  00 00 00 00 00 00 21 00 00 00 0d 11 31 39 32 2e   ......!.....192.
0020  31 36 38 2e 39 35 2e 36 36 46 45 2d 46 43 2d 46   168.95.66FE-FC-F
0030  45 2d 42 33 2d 37 36 2d 39 42 00                  E-B3-76-9B.

No.     Time           Source                Destination           Protocol Length Info
     14 0.127794       192.168.100.158       192.168.90.253        TCP      54     39743 → 5527 [ACK] Seq=63 Ack=106 Win=16379 Len=0

Frame 14: 54 bytes on wire (432 bits), 54 bytes captured (432 bits)
Ethernet II, Src: Private_02:05:da (90:6f:18:02:05:da), Dst: BaudDataComm_bb:a4:99 (98:45:62:bb:a4:99)
Internet Protocol Version 4, Src: 192.168.100.158, Dst: 192.168.90.253
Transmission Control Protocol, Src Port: 39743, Dst Port: 5527, Seq: 63, Ack: 106, Len: 0

No.     Time           Source                Destination           Protocol Length Info
     15 0.476773       192.168.100.158       192.168.90.253        VNC      58     

Frame 15: 58 bytes on wire (464 bits), 58 bytes captured (464 bits)
Ethernet II, Src: Private_02:05:da (90:6f:18:02:05:da), Dst: BaudDataComm_bb:a4:99 (98:45:62:bb:a4:99)
Internet Protocol Version 4, Src: 192.168.100.158, Dst: 192.168.90.253
Transmission Control Protocol, Src Port: 39746, Dst Port: 5500, Seq: 1, Ack: 1, Len: 4
Virtual Network Computing

No.     Time           Source                Destination           Protocol Length Info
     16 0.477332       192.168.90.253        192.168.100.158       VNC      60     

Frame 16: 60 bytes on wire (480 bits), 60 bytes captured (480 bits)
Ethernet II, Src: BaudDataComm_d6:a1:6c (98:45:62:d6:a1:6c), Dst: Private_02:05:da (90:6f:18:02:05:da)
Internet Protocol Version 4, Src: 192.168.90.253, Dst: 192.168.100.158
Transmission Control Protocol, Src Port: 5500, Dst Port: 39746, Seq: 1, Ack: 5, Len: 4
Virtual Network Computing

No.     Time           Source                Destination           Protocol Length Info
     17 0.523059       192.168.100.158       192.168.90.253        TCP      54     39746 → 5500 [ACK] Seq=5 Ack=5 Win=2043 Len=0

Frame 17: 54 bytes on wire (432 bits), 54 bytes captured (432 bits)
Ethernet II, Src: Private_02:05:da (90:6f:18:02:05:da), Dst: BaudDataComm_bb:a4:99 (98:45:62:bb:a4:99)
Internet Protocol Version 4, Src: 192.168.100.158, Dst: 192.168.90.253
Transmission Control Protocol, Src Port: 39746, Dst Port: 5500, Seq: 5, Ack: 5, Len: 0

No.     Time           Source                Destination           Protocol Length Info
     18 0.611562       192.168.100.171       239.255.255.250       UDP/XML  698    56710 → 3702 Len=656

Frame 18: 698 bytes on wire (5584 bits), 698 bytes captured (5584 bits)
Ethernet II, Src: Private_02:04:4e (90:6f:18:02:04:4e), Dst: IPv4mcast_7f:ff:fa (01:00:5e:7f:ff:fa)
Internet Protocol Version 4, Src: 192.168.100.171, Dst: 239.255.255.250
User Datagram Protocol, Src Port: 56710, Dst Port: 3702
eXtensible Markup Language

No.     Time           Source                Destination           Protocol Length Info
     19 0.713082       192.168.100.158       192.168.90.250        TCP      55     39732 → 443 [ACK] Seq=1 Ack=1 Win=1021 Len=1 [TCP PDU reassembled in 21]

Frame 19: 55 bytes on wire (440 bits), 55 bytes captured (440 bits)
Ethernet II, Src: Private_02:05:da (90:6f:18:02:05:da), Dst: BaudDataComm_bb:a4:99 (98:45:62:bb:a4:99)
Internet Protocol Version 4, Src: 192.168.100.158, Dst: 192.168.90.250
Transmission Control Protocol, Src Port: 39732, Dst Port: 443, Seq: 1, Ack: 1, Len: 1

No.     Time           Source                Destination           Protocol Length Info
     20 0.713645       192.168.90.250        192.168.100.158       TCP      60     443 → 39732 [ACK] Seq=1 Ack=2 Win=229 Len=0

Frame 20: 60 bytes on wire (480 bits), 60 bytes captured (480 bits)
Ethernet II, Src: BaudDataComm_d6:a1:6c (98:45:62:d6:a1:6c), Dst: Private_02:05:da (90:6f:18:02:05:da)
Internet Protocol Version 4, Src: 192.168.90.250, Dst: 192.168.100.158
Transmission Control Protocol, Src Port: 443, Dst Port: 39732, Seq: 1, Ack: 2, Len: 0

No.     Time           Source                Destination           Protocol Length Info
     21 0.788348       192.168.100.158       192.168.90.250        SSL      82     Continuation Data[Illegal Segments]

Frame 21: 82 bytes on wire (656 bits), 82 bytes captured (656 bits)
Ethernet II, Src: Private_02:05:da (90:6f:18:02:05:da), Dst: BaudDataComm_bb:a4:99 (98:45:62:bb:a4:99)
Internet Protocol Version 4, Src: 192.168.100.158, Dst: 192.168.90.250
Transmission Control Protocol, Src Port: 39732, Dst Port: 443, Seq: 2, Ack: 1, Len: 28
[3 Reassembled TCP Segments (29 bytes): #19(1), #21(28), #100(1)]
Transport Layer Security

No.     Time           Source                Destination           Protocol Length Info
     22 0.788896       192.168.90.250        192.168.100.158       TCP      60     443 → 39732 [ACK] Seq=1 Ack=30 Win=229 Len=0

Frame 22: 60 bytes on wire (480 bits), 60 bytes captured (480 bits)
Ethernet II, Src: BaudDataComm_d6:a1:6c (98:45:62:d6:a1:6c), Dst: Private_02:05:da (90:6f:18:02:05:da)
Internet Protocol Version 4, Src: 192.168.90.250, Dst: 192.168.100.158
Transmission Control Protocol, Src Port: 443, Dst Port: 39732, Seq: 1, Ack: 30, Len: 0

No.     Time           Source                Destination           Protocol Length Info
     23 0.789754       192.168.90.250        192.168.100.158       TCP      114    443 → 39732 [PSH, ACK] Seq=1 Ack=30 Win=229 Len=60

Frame 23: 114 bytes on wire (912 bits), 114 bytes captured (912 bits)
Ethernet II, Src: BaudDataComm_d6:a1:6c (98:45:62:d6:a1:6c), Dst: Private_02:05:da (90:6f:18:02:05:da)
Internet Protocol Version 4, Src: 192.168.90.250, Dst: 192.168.100.158
Transmission Control Protocol, Src Port: 443, Dst Port: 39732, Seq: 1, Ack: 30, Len: 60
Data (60 bytes)

0000  41 43 4b 51 00 00 00 02 06 7d e0 cb 00 00 01 2c   ACKQ.....}.....,
0010  4d 6a 55 77 6b 44 7a 68 52 53 55 62 37 33 64 49   MjUwkDzhRSUb73dI
0020  00 00 00 00 00 00 00 00 00 00 00 00 00 00 00 00   ................
0030  00 00 00 00 00 00 00 00 00 00 00 00               ............

No.     Time           Source                Destination           Protocol Length Info
     24 0.840614       192.168.100.158       192.168.90.250        TCP      54     39732 → 443 [ACK] Seq=30 Ack=61 Win=1020 Len=0

Frame 24: 54 bytes on wire (432 bits), 54 bytes captured (432 bits)
Ethernet II, Src: Private_02:05:da (90:6f:18:02:05:da), Dst: BaudDataComm_bb:a4:99 (98:45:62:bb:a4:99)
Internet Protocol Version 4, Src: 192.168.100.158, Dst: 192.168.90.250
Transmission Control Protocol, Src Port: 39732, Dst Port: 443, Seq: 30, Ack: 61, Len: 0

No.     Time           Source                Destination           Protocol Length Info
     26 1.464453       192.168.100.115       192.168.255.255       UDP      86     57621 → 57621 Len=44

Frame 26: 86 bytes on wire (688 bits), 86 bytes captured (688 bits)
Ethernet II, Src: JMicronIntel_c4:da:de (ec:d6:8a:c4:da:de), Dst: Broadcast (ff:ff:ff:ff:ff:ff)
Internet Protocol Version 4, Src: 192.168.100.115, Dst: 192.168.255.255
User Datagram Protocol, Src Port: 57621, Dst Port: 57621
Data (44 bytes)

0000  53 70 6f 74 55 64 70 30 6a 8d 57 ff 06 5d 8a 6c   SpotUdp0j.W..].l
0010  00 01 00 04 48 95 c2 03 a5 8a 1b 60 c1 9a 6d a2   ....H......`..m.
0020  eb 83 cc 74 f4 be 70 81 83 4a 93 bd               ...t..p..J..

No.     Time           Source                Destination           Protocol Length Info
     27 1.477194       192.168.100.158       192.168.90.253        VNC      58     

Frame 27: 58 bytes on wire (464 bits), 58 bytes captured (464 bits)
Ethernet II, Src: Private_02:05:da (90:6f:18:02:05:da), Dst: BaudDataComm_bb:a4:99 (98:45:62:bb:a4:99)
Internet Protocol Version 4, Src: 192.168.100.158, Dst: 192.168.90.253
Transmission Control Protocol, Src Port: 39746, Dst Port: 5500, Seq: 5, Ack: 5, Len: 4
Virtual Network Computing

No.     Time           Source                Destination           Protocol Length Info
     28 1.477787       192.168.90.253        192.168.100.158       VNC      60     

Frame 28: 60 bytes on wire (480 bits), 60 bytes captured (480 bits)
Ethernet II, Src: BaudDataComm_d6:a1:6c (98:45:62:d6:a1:6c), Dst: Private_02:05:da (90:6f:18:02:05:da)
Internet Protocol Version 4, Src: 192.168.90.253, Dst: 192.168.100.158
Transmission Control Protocol, Src Port: 5500, Dst Port: 39746, Seq: 5, Ack: 9, Len: 4
Virtual Network Computing

No.     Time           Source                Destination           Protocol Length Info
     29 1.524342       192.168.100.158       192.168.90.253        TCP      54     39746 → 5500 [ACK] Seq=9 Ack=9 Win=2043 Len=0

Frame 29: 54 bytes on wire (432 bits), 54 bytes captured (432 bits)
Ethernet II, Src: Private_02:05:da (90:6f:18:02:05:da), Dst: BaudDataComm_bb:a4:99 (98:45:62:bb:a4:99)
Internet Protocol Version 4, Src: 192.168.100.158, Dst: 192.168.90.253
Transmission Control Protocol, Src Port: 39746, Dst Port: 5500, Seq: 9, Ack: 9, Len: 0

No.     Time           Source                Destination           Protocol Length Info
     31 1.752761       192.168.100.163       255.255.255.255       DB-LSP-DISC/JSON 177    Dropbox LAN sync Discovery Protocol, JSON

Frame 31: 177 bytes on wire (1416 bits), 177 bytes captured (1416 bits)
Ethernet II, Src: JMicronIntel_c4:d9:73 (ec:d6:8a:c4:d9:73), Dst: Broadcast (ff:ff:ff:ff:ff:ff)
Internet Protocol Version 4, Src: 192.168.100.163, Dst: 255.255.255.255
User Datagram Protocol, Src Port: 17500, Dst Port: 17500
Dropbox LAN sync Discovery Protocol

No.     Time           Source                Destination           Protocol Length Info
     32 1.754833       192.168.100.163       192.168.100.255       DB-LSP-DISC/JSON 177    Dropbox LAN sync Discovery Protocol, JSON

Frame 32: 177 bytes on wire (1416 bits), 177 bytes captured (1416 bits)
Ethernet II, Src: JMicronIntel_c4:d9:73 (ec:d6:8a:c4:d9:73), Dst: Broadcast (ff:ff:ff:ff:ff:ff)
Internet Protocol Version 4, Src: 192.168.100.163, Dst: 192.168.100.255
User Datagram Protocol, Src Port: 17500, Dst Port: 17500
Dropbox LAN sync Discovery Protocol

No.     Time           Source                Destination           Protocol Length Info
     33 1.754833       192.168.100.163       255.255.255.255       DB-LSP-DISC/JSON 177    Dropbox LAN sync Discovery Protocol, JSON

Frame 33: 177 bytes on wire (1416 bits), 177 bytes captured (1416 bits)
Ethernet II, Src: JMicronIntel_c4:d9:73 (ec:d6:8a:c4:d9:73), Dst: Broadcast (ff:ff:ff:ff:ff:ff)
Internet Protocol Version 4, Src: 192.168.100.163, Dst: 255.255.255.255
User Datagram Protocol, Src Port: 17500, Dst Port: 17500
Dropbox LAN sync Discovery Protocol

No.     Time           Source                Destination           Protocol Length Info
     34 1.858150       192.168.90.253        192.168.100.158       TCP      68     5527 → 39759 [PSH, ACK] Seq=1 Ack=1 Win=22 Len=14

Frame 34: 68 bytes on wire (544 bits), 68 bytes captured (544 bits)
Ethernet II, Src: BaudDataComm_d6:a1:6c (98:45:62:d6:a1:6c), Dst: Private_02:05:da (90:6f:18:02:05:da)
Internet Protocol Version 4, Src: 192.168.90.253, Dst: 192.168.100.158
Transmission Control Protocol, Src Port: 5527, Dst Port: 39759, Seq: 1, Ack: 1, Len: 14
Data (14 bytes)

0000  00 0c cb 33 15 0b 67 e0 21 0d 4b ce 0a 00         ...3..g.!.K...

No.     Time           Source                Destination           Protocol Length Info
     35 1.858150       192.168.90.253        192.168.100.158       TCP      68     5527 → 39759 [PSH, ACK] Seq=15 Ack=1 Win=22 Len=14

Frame 35: 68 bytes on wire (544 bits), 68 bytes captured (544 bits)
Ethernet II, Src: BaudDataComm_d6:a1:6c (98:45:62:d6:a1:6c), Dst: Private_02:05:da (90:6f:18:02:05:da)
Internet Protocol Version 4, Src: 192.168.90.253, Dst: 192.168.100.158
Transmission Control Protocol, Src Port: 5527, Dst Port: 39759, Seq: 15, Ack: 1, Len: 14
Data (14 bytes)

0000  00 0c cb 33 15 0b 75 47 22 0d 4b ce 0a 00         ...3..uG".K...

No.     Time           Source                Destination           Protocol Length Info
     36 1.858292       192.168.100.158       192.168.90.253        TCP      54     39759 → 5527 [ACK] Seq=1 Ack=29 Win=4094 Len=0

Frame 36: 54 bytes on wire (432 bits), 54 bytes captured (432 bits)
Ethernet II, Src: Private_02:05:da (90:6f:18:02:05:da), Dst: BaudDataComm_bb:a4:99 (98:45:62:bb:a4:99)
Internet Protocol Version 4, Src: 192.168.100.158, Dst: 192.168.90.253
Transmission Control Protocol, Src Port: 39759, Dst Port: 5527, Seq: 1, Ack: 29, Len: 0

No.     Time           Source                Destination           Protocol Length Info
     37 1.858375       192.168.100.158       192.168.90.253        TCP      72     39759 → 5527 [PSH, ACK] Seq=1 Ack=29 Win=4094 Len=18

Frame 37: 72 bytes on wire (576 bits), 72 bytes captured (576 bits)
Ethernet II, Src: Private_02:05:da (90:6f:18:02:05:da), Dst: BaudDataComm_bb:a4:99 (98:45:62:bb:a4:99)
Internet Protocol Version 4, Src: 192.168.100.158, Dst: 192.168.90.253
Transmission Control Protocol, Src Port: 39759, Dst Port: 5527, Seq: 1, Ack: 29, Len: 18
Data (18 bytes)

0000  03 00 0c 00 00 00 cb 33 15 0b 67 e0 21 0d 4b ce   .......3..g.!.K.
0010  0a 00                                             ..

No.     Time           Source                Destination           Protocol Length Info
     38 1.858400       192.168.100.158       192.168.90.253        TCP      72     39759 → 5527 [PSH, ACK] Seq=19 Ack=29 Win=4094 Len=18

Frame 38: 72 bytes on wire (576 bits), 72 bytes captured (576 bits)
Ethernet II, Src: Private_02:05:da (90:6f:18:02:05:da), Dst: BaudDataComm_bb:a4:99 (98:45:62:bb:a4:99)
Internet Protocol Version 4, Src: 192.168.100.158, Dst: 192.168.90.253
Transmission Control Protocol, Src Port: 39759, Dst Port: 5527, Seq: 19, Ack: 29, Len: 18
Data (18 bytes)

0000  03 00 0c 00 00 00 cb 33 15 0b 75 47 22 0d 4b ce   .......3..uG".K.
0010  0a 00                                             ..

No.     Time           Source                Destination           Protocol Length Info
     39 1.858913       192.168.90.253        192.168.100.158       TCP      60     5527 → 39759 [ACK] Seq=29 Ack=19 Win=22 Len=0

Frame 39: 60 bytes on wire (480 bits), 60 bytes captured (480 bits)
Ethernet II, Src: BaudDataComm_d6:a1:6c (98:45:62:d6:a1:6c), Dst: Private_02:05:da (90:6f:18:02:05:da)
Internet Protocol Version 4, Src: 192.168.90.253, Dst: 192.168.100.158
Transmission Control Protocol, Src Port: 5527, Dst Port: 39759, Seq: 29, Ack: 19, Len: 0

No.     Time           Source                Destination           Protocol Length Info
     40 1.858913       192.168.90.253        192.168.100.158       TCP      60     5527 → 39759 [ACK] Seq=29 Ack=37 Win=22 Len=0

Frame 40: 60 bytes on wire (480 bits), 60 bytes captured (480 bits)
Ethernet II, Src: BaudDataComm_d6:a1:6c (98:45:62:d6:a1:6c), Dst: Private_02:05:da (90:6f:18:02:05:da)
Internet Protocol Version 4, Src: 192.168.90.253, Dst: 192.168.100.158
Transmission Control Protocol, Src Port: 5527, Dst Port: 39759, Seq: 29, Ack: 37, Len: 0

No.     Time           Source                Destination           Protocol Length Info
     41 2.224181       192.168.100.158       192.168.90.250        TCP      55     39737 → 443 [ACK] Seq=1 Ack=1 Win=1018 Len=1 [TCP PDU reassembled in 43]

Frame 41: 55 bytes on wire (440 bits), 55 bytes captured (440 bits)
Ethernet II, Src: Private_02:05:da (90:6f:18:02:05:da), Dst: BaudDataComm_bb:a4:99 (98:45:62:bb:a4:99)
Internet Protocol Version 4, Src: 192.168.100.158, Dst: 192.168.90.250
Transmission Control Protocol, Src Port: 39737, Dst Port: 443, Seq: 1, Ack: 1, Len: 1

No.     Time           Source                Destination           Protocol Length Info
     42 2.232678       192.168.90.250        192.168.100.158       TCP      60     443 → 39737 [ACK] Seq=1 Ack=2 Win=773 Len=0

Frame 42: 60 bytes on wire (480 bits), 60 bytes captured (480 bits)
Ethernet II, Src: BaudDataComm_d6:a1:6c (98:45:62:d6:a1:6c), Dst: Private_02:05:da (90:6f:18:02:05:da)
Internet Protocol Version 4, Src: 192.168.90.250, Dst: 192.168.100.158
Transmission Control Protocol, Src Port: 443, Dst Port: 39737, Seq: 1, Ack: 2, Len: 0

No.     Time           Source                Destination           Protocol Length Info
     43 2.255334       192.168.100.158       192.168.90.250        SSL      78     Continuation Data[Illegal Segments]

Frame 43: 78 bytes on wire (624 bits), 78 bytes captured (624 bits)
Ethernet II, Src: Private_02:05:da (90:6f:18:02:05:da), Dst: BaudDataComm_bb:a4:99 (98:45:62:bb:a4:99)
Internet Protocol Version 4, Src: 192.168.100.158, Dst: 192.168.90.250
Transmission Control Protocol, Src Port: 39737, Dst Port: 443, Seq: 2, Ack: 1, Len: 24
[3 Reassembled TCP Segments (25 bytes): #41(1), #43(24), #116(1)]
Transport Layer Security

No.     Time           Source                Destination           Protocol Length Info
     44 2.257274       192.168.90.250        192.168.100.158       TCP      60     443 → 39737 [ACK] Seq=1 Ack=26 Win=773 Len=0

Frame 44: 60 bytes on wire (480 bits), 60 bytes captured (480 bits)
Ethernet II, Src: BaudDataComm_d6:a1:6c (98:45:62:d6:a1:6c), Dst: Private_02:05:da (90:6f:18:02:05:da)
Internet Protocol Version 4, Src: 192.168.90.250, Dst: 192.168.100.158
Transmission Control Protocol, Src Port: 443, Dst Port: 39737, Seq: 1, Ack: 26, Len: 0

No.     Time           Source                Destination           Protocol Length Info
     45 2.257274       192.168.90.250        192.168.100.158       SSL      78     Continuation Data

Frame 45: 78 bytes on wire (624 bits), 78 bytes captured (624 bits)
Ethernet II, Src: BaudDataComm_d6:a1:6c (98:45:62:d6:a1:6c), Dst: Private_02:05:da (90:6f:18:02:05:da)
Internet Protocol Version 4, Src: 192.168.90.250, Dst: 192.168.100.158
Transmission Control Protocol, Src Port: 443, Dst Port: 39737, Seq: 1, Ack: 26, Len: 24
Transport Layer Security

No.     Time           Source                Destination           Protocol Length Info
     46 2.302526       192.168.100.158       192.168.90.250        TCP      54     39737 → 443 [ACK] Seq=26 Ack=25 Win=1023 Len=0

Frame 46: 54 bytes on wire (432 bits), 54 bytes captured (432 bits)
Ethernet II, Src: Private_02:05:da (90:6f:18:02:05:da), Dst: BaudDataComm_bb:a4:99 (98:45:62:bb:a4:99)
Internet Protocol Version 4, Src: 192.168.100.158, Dst: 192.168.90.250
Transmission Control Protocol, Src Port: 39737, Dst Port: 443, Seq: 26, Ack: 25, Len: 0

No.     Time           Source                Destination           Protocol Length Info
     47 2.476487       192.168.100.158       192.168.90.253        VNC      58     

Frame 47: 58 bytes on wire (464 bits), 58 bytes captured (464 bits)
Ethernet II, Src: Private_02:05:da (90:6f:18:02:05:da), Dst: BaudDataComm_bb:a4:99 (98:45:62:bb:a4:99)
Internet Protocol Version 4, Src: 192.168.100.158, Dst: 192.168.90.253
Transmission Control Protocol, Src Port: 39746, Dst Port: 5500, Seq: 9, Ack: 9, Len: 4
Virtual Network Computing

No.     Time           Source                Destination           Protocol Length Info
     48 2.477045       192.168.90.253        192.168.100.158       VNC      60     

Frame 48: 60 bytes on wire (480 bits), 60 bytes captured (480 bits)
Ethernet II, Src: BaudDataComm_d6:a1:6c (98:45:62:d6:a1:6c), Dst: Private_02:05:da (90:6f:18:02:05:da)
Internet Protocol Version 4, Src: 192.168.90.253, Dst: 192.168.100.158
Transmission Control Protocol, Src Port: 5500, Dst Port: 39746, Seq: 9, Ack: 13, Len: 4
Virtual Network Computing

No.     Time           Source                Destination           Protocol Length Info
     49 2.524246       192.168.100.158       192.168.90.253        TCP      54     39746 → 5500 [ACK] Seq=13 Ack=13 Win=2043 Len=0

Frame 49: 54 bytes on wire (432 bits), 54 bytes captured (432 bits)
Ethernet II, Src: Private_02:05:da (90:6f:18:02:05:da), Dst: BaudDataComm_bb:a4:99 (98:45:62:bb:a4:99)
Internet Protocol Version 4, Src: 192.168.100.158, Dst: 192.168.90.253
Transmission Control Protocol, Src Port: 39746, Dst Port: 5500, Seq: 13, Ack: 13, Len: 0

No.     Time           Source                Destination           Protocol Length Info
     50 2.590739       192.168.90.253        192.168.100.158       TCP      68     5527 → 39757 [PSH, ACK] Seq=1 Ack=1 Win=22 Len=14

Frame 50: 68 bytes on wire (544 bits), 68 bytes captured (544 bits)
Ethernet II, Src: BaudDataComm_d6:a1:6c (98:45:62:d6:a1:6c), Dst: Private_02:05:da (90:6f:18:02:05:da)
Internet Protocol Version 4, Src: 192.168.90.253, Dst: 192.168.100.158
Transmission Control Protocol, Src Port: 5527, Dst Port: 39757, Seq: 1, Ack: 1, Len: 14
Data (14 bytes)

0000  00 0c 82 9e 87 28 7c 98 cc 38 4b ce 0a 00         .....(|..8K...

No.     Time           Source                Destination           Protocol Length Info
     51 2.590739       192.168.90.253        192.168.100.158       TCP      68     5527 → 39757 [PSH, ACK] Seq=15 Ack=1 Win=22 Len=14

Frame 51: 68 bytes on wire (544 bits), 68 bytes captured (544 bits)
Ethernet II, Src: BaudDataComm_d6:a1:6c (98:45:62:d6:a1:6c), Dst: Private_02:05:da (90:6f:18:02:05:da)
Internet Protocol Version 4, Src: 192.168.90.253, Dst: 192.168.100.158
Transmission Control Protocol, Src Port: 5527, Dst Port: 39757, Seq: 15, Ack: 1, Len: 14
Data (14 bytes)

0000  00 0c 82 9e 87 28 06 ea cc 38 4b ce 0a 00         .....(...8K...

No.     Time           Source                Destination           Protocol Length Info
     52 2.590957       192.168.100.158       192.168.90.253        TCP      54     39757 → 5527 [ACK] Seq=1 Ack=29 Win=16383 Len=0

Frame 52: 54 bytes on wire (432 bits), 54 bytes captured (432 bits)
Ethernet II, Src: Private_02:05:da (90:6f:18:02:05:da), Dst: BaudDataComm_bb:a4:99 (98:45:62:bb:a4:99)
Internet Protocol Version 4, Src: 192.168.100.158, Dst: 192.168.90.253
Transmission Control Protocol, Src Port: 39757, Dst Port: 5527, Seq: 1, Ack: 29, Len: 0

No.     Time           Source                Destination           Protocol Length Info
     53 2.591115       192.168.100.158       192.168.90.253        TCP      72     39757 → 5527 [PSH, ACK] Seq=1 Ack=29 Win=16383 Len=18

Frame 53: 72 bytes on wire (576 bits), 72 bytes captured (576 bits)
Ethernet II, Src: Private_02:05:da (90:6f:18:02:05:da), Dst: BaudDataComm_bb:a4:99 (98:45:62:bb:a4:99)
Internet Protocol Version 4, Src: 192.168.100.158, Dst: 192.168.90.253
Transmission Control Protocol, Src Port: 39757, Dst Port: 5527, Seq: 1, Ack: 29, Len: 18
Data (18 bytes)

0000  03 00 0c 00 00 00 82 9e 87 28 7c 98 cc 38 4b ce   .........(|..8K.
0010  0a 00                                             ..

No.     Time           Source                Destination           Protocol Length Info
     54 2.591172       192.168.100.158       192.168.90.253        TCP      72     39757 → 5527 [PSH, ACK] Seq=19 Ack=29 Win=16383 Len=18

Frame 54: 72 bytes on wire (576 bits), 72 bytes captured (576 bits)
Ethernet II, Src: Private_02:05:da (90:6f:18:02:05:da), Dst: BaudDataComm_bb:a4:99 (98:45:62:bb:a4:99)
Internet Protocol Version 4, Src: 192.168.100.158, Dst: 192.168.90.253
Transmission Control Protocol, Src Port: 39757, Dst Port: 5527, Seq: 19, Ack: 29, Len: 18
Data (18 bytes)

0000  03 00 0c 00 00 00 82 9e 87 28 06 ea cc 38 4b ce   .........(...8K.
0010  0a 00                                             ..

No.     Time           Source                Destination           Protocol Length Info
     55 2.591601       192.168.90.253        192.168.100.158       TCP      60     5527 → 39757 [ACK] Seq=29 Ack=19 Win=22 Len=0

Frame 55: 60 bytes on wire (480 bits), 60 bytes captured (480 bits)
Ethernet II, Src: BaudDataComm_d6:a1:6c (98:45:62:d6:a1:6c), Dst: Private_02:05:da (90:6f:18:02:05:da)
Internet Protocol Version 4, Src: 192.168.90.253, Dst: 192.168.100.158
Transmission Control Protocol, Src Port: 5527, Dst Port: 39757, Seq: 29, Ack: 19, Len: 0

No.     Time           Source                Destination           Protocol Length Info
     56 2.591601       192.168.90.253        192.168.100.158       TCP      60     5527 → 39757 [ACK] Seq=29 Ack=37 Win=22 Len=0

Frame 56: 60 bytes on wire (480 bits), 60 bytes captured (480 bits)
Ethernet II, Src: BaudDataComm_d6:a1:6c (98:45:62:d6:a1:6c), Dst: Private_02:05:da (90:6f:18:02:05:da)
Internet Protocol Version 4, Src: 192.168.90.253, Dst: 192.168.100.158
Transmission Control Protocol, Src Port: 5527, Dst Port: 39757, Seq: 29, Ack: 37, Len: 0

No.     Time           Source                Destination           Protocol Length Info
     57 2.617151       192.168.100.171       239.255.255.250       UDP/XML  698    56710 → 3702 Len=656

Frame 57: 698 bytes on wire (5584 bits), 698 bytes captured (5584 bits)
Ethernet II, Src: Private_02:04:4e (90:6f:18:02:04:4e), Dst: IPv4mcast_7f:ff:fa (01:00:5e:7f:ff:fa)
Internet Protocol Version 4, Src: 192.168.100.171, Dst: 239.255.255.250
User Datagram Protocol, Src Port: 56710, Dst Port: 3702
eXtensible Markup Language

No.     Time           Source                Destination           Protocol Length Info
     58 2.646680       192.168.100.115       239.192.152.143       LSD      179    

Frame 58: 179 bytes on wire (1432 bits), 179 bytes captured (1432 bits)
Ethernet II, Src: JMicronIntel_c4:da:de (ec:d6:8a:c4:da:de), Dst: IPv4mcast_40:98:8f (01:00:5e:40:98:8f)
Internet Protocol Version 4, Src: 192.168.100.115, Dst: 239.192.152.143
User Datagram Protocol, Src Port: 6771, Dst Port: 6771
Local Service Discovery

No.     Time           Source                Destination           Protocol Length Info
     59 2.646783       192.168.100.115       239.192.152.143       LSD      178    

Frame 59: 178 bytes on wire (1424 bits), 178 bytes captured (1424 bits)
Ethernet II, Src: JMicronIntel_c4:da:de (ec:d6:8a:c4:da:de), Dst: IPv4mcast_40:98:8f (01:00:5e:40:98:8f)
Internet Protocol Version 4, Src: 192.168.100.115, Dst: 239.192.152.143
User Datagram Protocol, Src Port: 6771, Dst Port: 6771
Local Service Discovery

No.     Time           Source                Destination           Protocol Length Info
     60 2.647413       192.168.100.115       239.192.152.143       LSD      178    

Frame 60: 178 bytes on wire (1424 bits), 178 bytes captured (1424 bits)
Ethernet II, Src: JMicronIntel_c4:da:de (ec:d6:8a:c4:da:de), Dst: IPv4mcast_40:98:8f (01:00:5e:40:98:8f)
Internet Protocol Version 4, Src: 192.168.100.115, Dst: 239.192.152.143
User Datagram Protocol, Src Port: 6771, Dst Port: 6771
Local Service Discovery

No.     Time           Source                Destination           Protocol Length Info
     61 2.647446       192.168.100.115       239.192.152.143       LSD      179    

Frame 61: 179 bytes on wire (1432 bits), 179 bytes captured (1432 bits)
Ethernet II, Src: JMicronIntel_c4:da:de (ec:d6:8a:c4:da:de), Dst: IPv4mcast_40:98:8f (01:00:5e:40:98:8f)
Internet Protocol Version 4, Src: 192.168.100.115, Dst: 239.192.152.143
User Datagram Protocol, Src Port: 6771, Dst Port: 6771
Local Service Discovery

No.     Time           Source                Destination           Protocol Length Info
     62 2.647805       192.168.100.115       239.192.152.143       LSD      179    

Frame 62: 179 bytes on wire (1432 bits), 179 bytes captured (1432 bits)
Ethernet II, Src: JMicronIntel_c4:da:de (ec:d6:8a:c4:da:de), Dst: IPv4mcast_40:98:8f (01:00:5e:40:98:8f)
Internet Protocol Version 4, Src: 192.168.100.115, Dst: 239.192.152.143
User Datagram Protocol, Src Port: 6771, Dst Port: 6771
Local Service Discovery

No.     Time           Source                Destination           Protocol Length Info
     63 2.664109       192.168.100.115       239.192.152.143       LSD      179    

Frame 63: 179 bytes on wire (1432 bits), 179 bytes captured (1432 bits)
Ethernet II, Src: JMicronIntel_c4:da:de (ec:d6:8a:c4:da:de), Dst: IPv4mcast_40:98:8f (01:00:5e:40:98:8f)
Internet Protocol Version 4, Src: 192.168.100.115, Dst: 239.192.152.143
User Datagram Protocol, Src Port: 6771, Dst Port: 6771
Local Service Discovery

No.     Time           Source                Destination           Protocol Length Info
     64 2.664109       192.168.100.115       239.192.152.143       LSD      179    

Frame 64: 179 bytes on wire (1432 bits), 179 bytes captured (1432 bits)
Ethernet II, Src: JMicronIntel_c4:da:de (ec:d6:8a:c4:da:de), Dst: IPv4mcast_40:98:8f (01:00:5e:40:98:8f)
Internet Protocol Version 4, Src: 192.168.100.115, Dst: 239.192.152.143
User Datagram Protocol, Src Port: 6771, Dst Port: 6771
Local Service Discovery

No.     Time           Source                Destination           Protocol Length Info
     66 3.099873       192.168.90.253        192.168.100.158       TCP      72     5527 → 39743 [PSH, ACK] Seq=106 Ack=63 Win=281 Len=18

Frame 66: 72 bytes on wire (576 bits), 72 bytes captured (576 bits)
Ethernet II, Src: BaudDataComm_d6:a1:6c (98:45:62:d6:a1:6c), Dst: Private_02:05:da (90:6f:18:02:05:da)
Internet Protocol Version 4, Src: 192.168.90.253, Dst: 192.168.100.158
Transmission Control Protocol, Src Port: 5527, Dst Port: 39743, Seq: 106, Ack: 63, Len: 18
Data (18 bytes)

0000  04 00 0c 00 00 00 59 a6 ba 18 3d f9 24 57 4b ce   ......Y...=.$WK.
0010  0a 00                                             ..

No.     Time           Source                Destination           Protocol Length Info
     67 3.099873       192.168.90.253        192.168.100.158       TCP      72     5527 → 39743 [PSH, ACK] Seq=124 Ack=63 Win=281 Len=18

Frame 67: 72 bytes on wire (576 bits), 72 bytes captured (576 bits)
Ethernet II, Src: BaudDataComm_d6:a1:6c (98:45:62:d6:a1:6c), Dst: Private_02:05:da (90:6f:18:02:05:da)
Internet Protocol Version 4, Src: 192.168.90.253, Dst: 192.168.100.158
Transmission Control Protocol, Src Port: 5527, Dst Port: 39743, Seq: 124, Ack: 63, Len: 18
Data (18 bytes)

0000  04 00 0c 00 00 00 59 a6 ba 18 78 4e 25 57 4b ce   ......Y...xN%WK.
0010  0a 00                                             ..

No.     Time           Source                Destination           Protocol Length Info
     68 3.100026       192.168.100.158       192.168.90.253        TCP      54     39743 → 5527 [ACK] Seq=63 Ack=142 Win=16379 Len=0

Frame 68: 54 bytes on wire (432 bits), 54 bytes captured (432 bits)
Ethernet II, Src: Private_02:05:da (90:6f:18:02:05:da), Dst: BaudDataComm_bb:a4:99 (98:45:62:bb:a4:99)
Internet Protocol Version 4, Src: 192.168.100.158, Dst: 192.168.90.253
Transmission Control Protocol, Src Port: 39743, Dst Port: 5527, Seq: 63, Ack: 142, Len: 0

No.     Time           Source                Destination           Protocol Length Info
     69 3.100111       192.168.100.158       192.168.90.253        TCP      72     39743 → 5527 [PSH, ACK] Seq=63 Ack=142 Win=16379 Len=18

Frame 69: 72 bytes on wire (576 bits), 72 bytes captured (576 bits)
Ethernet II, Src: Private_02:05:da (90:6f:18:02:05:da), Dst: BaudDataComm_bb:a4:99 (98:45:62:bb:a4:99)
Internet Protocol Version 4, Src: 192.168.100.158, Dst: 192.168.90.253
Transmission Control Protocol, Src Port: 39743, Dst Port: 5527, Seq: 63, Ack: 142, Len: 18
Data (18 bytes)

0000  03 00 0c 00 00 00 59 a6 ba 18 3d f9 24 57 4b ce   ......Y...=.$WK.
0010  0a 00                                             ..

No.     Time           Source                Destination           Protocol Length Info
     70 3.100143       192.168.100.158       192.168.90.253        TCP      72     39743 → 5527 [PSH, ACK] Seq=81 Ack=142 Win=16379 Len=18

Frame 70: 72 bytes on wire (576 bits), 72 bytes captured (576 bits)
Ethernet II, Src: Private_02:05:da (90:6f:18:02:05:da), Dst: BaudDataComm_bb:a4:99 (98:45:62:bb:a4:99)
Internet Protocol Version 4, Src: 192.168.100.158, Dst: 192.168.90.253
Transmission Control Protocol, Src Port: 39743, Dst Port: 5527, Seq: 81, Ack: 142, Len: 18
Data (18 bytes)

0000  03 00 0c 00 00 00 59 a6 ba 18 78 4e 25 57 4b ce   ......Y...xN%WK.
0010  0a 00                                             ..

No.     Time           Source                Destination           Protocol Length Info
     71 3.100633       192.168.90.253        192.168.100.158       TCP      60     5527 → 39743 [ACK] Seq=142 Ack=99 Win=281 Len=0

Frame 71: 60 bytes on wire (480 bits), 60 bytes captured (480 bits)
Ethernet II, Src: BaudDataComm_d6:a1:6c (98:45:62:d6:a1:6c), Dst: Private_02:05:da (90:6f:18:02:05:da)
Internet Protocol Version 4, Src: 192.168.90.253, Dst: 192.168.100.158
Transmission Control Protocol, Src Port: 5527, Dst Port: 39743, Seq: 142, Ack: 99, Len: 0

No.     Time           Source                Destination           Protocol Length Info
     72 3.474945       192.168.100.158       192.168.90.253        VNC      58     

Frame 72: 58 bytes on wire (464 bits), 58 bytes captured (464 bits)
Ethernet II, Src: Private_02:05:da (90:6f:18:02:05:da), Dst: BaudDataComm_bb:a4:99 (98:45:62:bb:a4:99)
